{
  "projectName": "Zeno's Planner",
  "projectVersion": "0.3.0",
  "currentGate": null,
  "totalGatesPlanned": 14,
  "endState": "Zeno's Planner is a lightweight, LLM-friendly project planning and orchestration tool that enhances human 'vibe coding' by maintaining long-term project memory, reducing context size, and ensuring consistency from vision through implementation. Conceptually inspired by Zeno's dichotomy paradox, the tool generates iterative gates (milestones) that progressively approach project completion, with each gate requiring human approval and automated quality checks.",
  "startState": null,
  "completedGates": [
    {
      "sequence": 1,
      "name": "Gate 01: Core Infrastructure",
      "hash": "g01c0re1nfra",
      "completedAt": "2026-01-28",
      "status": "completed"
    },
    {
      "sequence": 2,
      "name": "Gate 02: Zeno Engine & Gate Generation",
      "hash": "g02zenoeng",
      "completedAt": "2026-01-30",
      "status": "completed"
    },
    {
      "sequence": 3,
      "name": "Gate 03: MCP Server & LLM Tool Integration",
      "hash": "g03mcpserver",
      "completedAt": "2026-02-04",
      "status": "completed"
    },
    {
      "sequence": 4,
      "name": "Gate 04: Requirements & Database Layer",
      "hash": "g04reqdb01",
      "completedAt": "2026-02-07",
      "status": "completed"
    },
    {
      "sequence": 5,
      "name": "Gate 05: Architecture & Diagram Generation",
      "hash": "g05archdiag",
      "completedAt": "2026-02-21",
      "status": "completed"
    },
    {
      "sequence": 6,
      "name": "Gate 06: Multi-Repo & Subproject Detection",
      "hash": "g06multirepo",
      "completedAt": "2026-03-06",
      "status": "completed"
    },
    {
      "sequence": 7,
      "name": "Gate 07: Proposal Generation & Management",
      "hash": "g07proposal",
      "completedAt": "2026-03-14",
      "status": "completed"
    }
  ],
  "currentGateInfo": {
    "sequence": 8,
    "name": "Gate 08: Automated Validation & Quality Gates",
    "hash": "#gate08",
    "status": "pending",
    "estimatedComplexity": "high"
  },
  "upcomingGates": [
    {
      "sequence": 9,
      "name": "Gate 09: Human Approval & Rejection Workflow",
      "estimatedComplexity": "high"
    },
    {
      "sequence": 10,
      "name": "Gate 10: Git Integration & Commit Automation",
      "estimatedComplexity": "high"
    },
    {
      "sequence": 11,
      "name": "Gate 11: Rescope & Replan Engine",
      "estimatedComplexity": "high"
    },
    {
      "sequence": 12,
      "name": "Gate 12: Dashboard & Visualization",
      "estimatedComplexity": "high"
    },
    {
      "sequence": 13,
      "name": "Gate 13: Subagent Orchestration & Parallel Execution",
      "estimatedComplexity": "high"
    },
    {
      "sequence": 14,
      "name": "Gate 14: Documentation & Polish",
      "estimatedComplexity": "high"
    }
  ],
  "architecture": {
    "layers": [
      "CLI",
      "Core",
      "Analysis",
      "Generation",
      "Integration",
      "Storage"
    ],
    "keyDependencies": {
      "@babel/parser": "^7.26.3",
      "@babel/traverse": "^7.26.5",
      "@inquirer/prompts": "^7.8.0",
      "better-sqlite3": "^11.0.0",
      "commander": "^12.0.0",
      "zod": "^3.22.0"
    }
  }
}
